{
  "$id": "https://cairn.dev/schema/cairn.mcp.v1/envelope/signed_intent.json",
  "$schema": "https://json-schema.org/draft/2020-12/schema",
  "additionalProperties": false,
  "oneOf": [
    {
      "not": {
        "required": [
          "server_challenge"
        ]
      },
      "required": [
        "sequence"
      ]
    },
    {
      "not": {
        "required": [
          "sequence"
        ]
      },
      "required": [
        "server_challenge"
      ]
    }
  ],
  "properties": {
    "chain_parents": {
      "description": "operation_id ULIDs of prior operations this one depends on. Bounded and deduplicated so a malformed intent cannot push a pathologically large DAG fan-in at WAL dependency processing time.",
      "items": {
        "$ref": "../common/primitives.json#/$defs/Ulid"
      },
      "maxItems": 64,
      "type": "array",
      "uniqueItems": true
    },
    "expires_at": {
      "format": "date-time",
      "minLength": 20,
      "type": "string"
    },
    "issued_at": {
      "format": "date-time",
      "minLength": 20,
      "type": "string"
    },
    "issuer": {
      "allOf": [
        {
          "$ref": "../common/primitives.json#/$defs/Identity"
        }
      ],
      "description": "AgentIdentity, HumanIdentity, or SensorIdentity. Examples: agt:claude-code:opus-4-7:reviewer:v1, hmn:alice, snr:local:screen:host:v1."
    },
    "key_version": {
      "minimum": 1,
      "type": "integer"
    },
    "nonce": {
      "allOf": [
        {
          "$ref": "../common/primitives.json#/$defs/Nonce16Base64"
        }
      ],
      "description": "Fresh per message; 16 bytes base64-encoded (22 chars unpadded or 24 chars with `==` padding)."
    },
    "operation_id": {
      "allOf": [
        {
          "$ref": "../common/primitives.json#/$defs/Ulid"
        }
      ],
      "description": "ULID (Crockford base32, 26 chars); unique per issuer within expires_at window."
    },
    "scope": {
      "additionalProperties": false,
      "properties": {
        "entity": {
          "minLength": 1,
          "type": "string"
        },
        "tenant": {
          "minLength": 1,
          "type": "string"
        },
        "tier": {
          "enum": [
            "private",
            "session",
            "project",
            "team",
            "org",
            "public"
          ],
          "type": "string"
        },
        "workspace": {
          "minLength": 1,
          "type": "string"
        }
      },
      "required": [
        "tenant",
        "workspace",
        "entity",
        "tier"
      ],
      "type": "object"
    },
    "sequence": {
      "description": "Monotonic per-issuer counter; strictly increasing. Bounded by JSON's safe integer range (2^53 − 1) so validators and JSON decoders cannot disagree on the represented value. Mutually exclusive with server_challenge.",
      "maximum": 9007199254740991,
      "minimum": 0,
      "type": "integer"
    },
    "server_challenge": {
      "allOf": [
        {
          "$ref": "../common/primitives.json#/$defs/Nonce16Base64"
        }
      ],
      "description": "Fresh nonce obtained from `cairn handshake`; required when sequence is absent. Same 16-byte base64 shape as nonce."
    },
    "signature": {
      "allOf": [
        {
          "$ref": "../common/primitives.json#/$defs/Ed25519Signature"
        }
      ],
      "description": "Ed25519 signature over the canonical JSON of every other field. 64 raw bytes = 128 lowercase hex chars."
    },
    "target_hash": {
      "description": "sha256 of the record / plan / receipt this signature authorizes.",
      "pattern": "^sha256:[0-9a-f]{64}$",
      "type": "string"
    }
  },
  "required": [
    "operation_id",
    "nonce",
    "target_hash",
    "scope",
    "issuer",
    "issued_at",
    "expires_at",
    "key_version",
    "chain_parents",
    "signature"
  ],
  "title": "Cairn signed intent envelope",
  "type": "object",
  "x-cairn-contract": "cairn.mcp.v1"
}
